{
  "$schema": "https://json-schema.org/draft/2020-12/schema",
  "$id": "overworld-scenario-v1",
  "title": "Overworld scenario v1",
  "type": "object",
  "additionalProperties": false,
  "required": [
    "schemaVersion",
    "id",
    "title",
    "status",
    "capabilities",
    "proofLevel",
    "costTier",
    "fixture",
    "events",
    "stop",
    "expect",
    "capture",
    "adapter"
  ],
  "properties": {
    "schemaVersion": {"const": 1},
    "id": {"type": "string", "pattern": "^[a-z0-9][a-z0-9._-]*$"},
    "title": {"type": "string", "minLength": 1},
    "status": {"enum": ["active", "planned"]},
    "capabilities": {
      "type": "array",
      "minItems": 1,
      "uniqueItems": true,
      "items": {"type": "string", "pattern": "^[a-z0-9][a-z0-9._-]*$"}
    },
    "proofLevel": {"enum": ["S0", "S1", "S2", "S3", "S4", "S5"]},
    "costTier": {"type": "integer", "minimum": 0, "maximum": 5},
    "verification": {"$ref": "#/$defs/verification"},
    "roleProof": {
      "type": "array", "minItems": 1, "uniqueItems": true,
      "items": {
        "type": "object", "additionalProperties": false,
        "required": ["role", "claim", "measurement"],
        "properties": {
          "role": {"enum": ["Wild", "Follower", "Mounted", "Scripted"]},
          "claim": {"$ref": "#/$defs/runtimeProofClaims/items"},
          "measurement": {"type": "string", "minLength": 1}
        }
      }
    },
    "fixture": {
      "type": "object",
      "additionalProperties": false,
      "required": ["rom", "save", "seed"],
      "properties": {
        "rom": {"type": ["string", "null"]},
        "save": {
          "oneOf": [
            {"type": "null"},
            {
              "type": "object",
              "additionalProperties": false,
              "required": ["path", "kind"],
              "properties": {
                "path": {"type": "string", "minLength": 1},
                "kind": {"enum": ["dsv", "sav"]}
              }
            }
          ]
        },
        "seed": {"type": "integer", "minimum": 0, "maximum": 4294967295}
      }
    },
    "subjects": {
      "type": "array",
      "uniqueItems": true,
      "items": {
        "type": "object",
        "additionalProperties": false,
        "required": [
          "id",
          "species",
          "role",
          "acquisition",
          "minimum",
          "maximum",
          "motionActor",
          "requirePresentation"
        ],
        "properties": {
          "id": {"type": "string", "pattern": "^[a-z0-9][a-z0-9._-]*$"},
          "species": {"type": "integer", "minimum": 1, "maximum": 65535},
          "role": {"enum": ["WILD", "FOLLOWER", "MOUNTED", "SCRIPTED"]},
          "acquisition": {"enum": ["spawn", "follower", "mount", "script"]},
          "minimum": {"type": "integer", "minimum": 1, "maximum": 32},
          "maximum": {"type": "integer", "minimum": 1, "maximum": 32},
          "motionActor": {"type": "boolean"},
          "requirePresentation": {"type": "boolean"}
        }
      }
    },
    "events": {
      "type": "array",
      "items": {
        "type": "object",
        "additionalProperties": false,
        "required": ["at", "kind", "value"],
        "properties": {
          "at": {"type": "integer", "minimum": 0},
          "kind": {"enum": ["input", "lifecycle", "setup"]},
          "value": {"type": "string", "minLength": 1}
        }
      }
    },
    "stop": {
      "type": "object",
      "additionalProperties": false,
      "required": ["frameBudget", "condition"],
      "properties": {
        "frameBudget": {"type": "integer", "minimum": 1, "maximum": 1000000},
        "condition": {"type": "string", "minLength": 1}
      }
    },
    "expect": {
      "type": "object",
      "additionalProperties": false,
      "required": ["requiredEvents", "forbiddenEvents", "invariants"],
      "properties": {
        "requiredEvents": {"type": "array", "uniqueItems": true, "items": {"type": "string", "minLength": 1}},
        "forbiddenEvents": {"type": "array", "uniqueItems": true, "items": {"type": "string", "minLength": 1}},
        "invariants": {"type": "array", "minItems": 1, "uniqueItems": true, "items": {"type": "string", "minLength": 1}},
        "orderedEvents": {
          "type": "array",
          "minItems": 1,
          "items": {"$ref": "#/$defs/orderedEvent"}
        },
        "eventCounts": {
          "type": "array",
          "minItems": 1,
          "items": {"$ref": "#/$defs/eventCount"}
        },
        "frameTiming": {
          "type": "array",
          "minItems": 1,
          "items": {"$ref": "#/$defs/frameTiming"}
        }
      }
    },
    "capture": {"enum": ["none", "failure", "always"]},
    "adapter": {
      "oneOf": [
        {"type": "null"},
        {
          "type": "object",
          "additionalProperties": false,
          "required": ["kind", "test", "claims"],
          "properties": {
            "kind": {"const": "devtools-test"},
            "test": {"type": "string", "pattern": "^[a-z0-9][a-z0-9._-]{0,127}$"},
            "claims": {"$ref": "#/$defs/runtimeProofClaims"},
            "minimumFrames": {"type": "integer", "minimum": 1, "maximum": 120000}
          }
        },
        {
          "type": "object",
          "additionalProperties": false,
          "required": ["kind", "commands", "result"],
          "properties": {
            "kind": {"const": "command-sequence"},
            "commands": {
              "type": "array",
              "minItems": 1,
              "items": {
                "type": "array",
                "minItems": 1,
                "items": {"type": "string", "minLength": 1}
              }
            },
            "result": {"enum": ["exit-zero", "json-passed"]},
            "claims": {"$ref": "#/$defs/runtimeProofClaims"},
            "minimumFrames": {"type": "integer", "minimum": 1, "maximum": 1000000},
            "visualArtifact": {"$ref": "#/$defs/visualArtifact"}
          }
        },
        {
          "type": "object",
          "additionalProperties": false,
          "required": ["kind", "checks"],
          "dependentRequired": {
            "commands": ["result", "evidence"],
            "result": ["commands", "evidence"],
            "evidence": ["commands", "result"]
          },
          "properties": {
            "kind": {"const": "actor-observation"},
            "commands": {
              "type": "array",
              "minItems": 1,
              "items": {
                "type": "array",
                "minItems": 1,
                "items": {"type": "string", "minLength": 1}
              }
            },
            "result": {"enum": ["exit-zero", "json-passed"]},
            "evidence": {
              "type": "string",
              "pattern": "^build/overworld-evidence/[A-Za-z0-9._/-]+\\.json$"
            },
            "claims": {"$ref": "#/$defs/runtimeProofClaims"},
            "minimumFrames": {"type": "integer", "minimum": 1, "maximum": 1000000},
            "visualArtifact": {"$ref": "#/$defs/visualArtifact"},
            "motionWindowCount": {
              "type": "integer",
              "minimum": 1,
              "maximum": 32
            },
            "checks": {
              "type": "array",
              "minItems": 1,
              "uniqueItems": true,
              "items": {
                "enum": [
                  "trace-window-complete",
                  "terminal-result",
                  "no-commit-after-cancel",
                  "control-returned",
                  "single-motion-owner",
                  "target-reservation-serialized",
                  "path-advances-before-commit",
                  "field-epoch-current",
                  "presentation-attached",
                  "mounted-presentation-coordinates-equal",
                  "mounted-presentation-facing-locked"
                ]
              }
            }
          }
        }
      ]
    }
  },
  "allOf": [
    {
      "if": {"properties": {"proofLevel": {"enum": ["S3", "S4", "S5"]}}},
      "then": {"required": ["verification"]}
    },
    {
      "if": {"properties": {"status": {"const": "active"}}},
      "then": {"properties": {"adapter": {"not": {"type": "null"}}}}
    },
    {
      "if": {"properties": {"status": {"const": "planned"}}},
      "then": {"properties": {"adapter": {"type": "null"}}}
    },
    {
      "if": {
        "allOf": [
          {"properties": {"status": {"const": "active"}}},
          {"properties": {"proofLevel": {"enum": ["S3", "S4", "S5"]}}},
          {"properties": {"adapter": {"type": "object", "properties": {"kind": {"enum": ["command-sequence", "actor-observation"]}}}}}
        ]
      },
      "then": {
        "properties": {
          "adapter": {
            "required": ["commands", "claims", "result"],
            "properties": {"result": {"const": "json-passed"}}
          }
        }
      }
    },
    {
      "if": {
        "allOf": [
          {"properties": {"proofLevel": {"const": "S4"}}},
          {
            "properties": {
              "adapter": {
                "type": "object",
                "required": ["commands"]
              }
            }
          }
        ]
      },
      "then": {
        "properties": {
          "adapter": {
            "required": ["visualArtifact"],
            "properties": {
              "claims": {
                "contains": {
                  "enum": ["feedback-effect", "frame-pacing", "rendered-motion"]
                }
              }
            }
          }
        }
      }
    },
    {
      "if": {"properties": {"proofLevel": {"const": "S5"}}},
      "then": {
        "properties": {
          "adapter": {
            "required": ["minimumFrames"],
            "properties": {"minimumFrames": {"minimum": 5000}}
          },
          "stop": {
            "properties": {"frameBudget": {"minimum": 5000}}
          }
        }
      }
    }
  ],
  "$defs": {
    "verification": {
      "type": "object", "additionalProperties": false,
      "required": ["kind", "expectationSource", "actor", "trigger", "observable", "setupAudit", "setupMutations", "limits"],
      "properties": {
        "kind": {"enum": ["normal-play", "controlled-case", "observer-control"]},
        "expectationSource": {"type": "string", "minLength": 1},
        "actor": {"type": "string", "minLength": 1},
        "trigger": {"type": "string", "minLength": 1},
        "observable": {"type": "string", "minLength": 1},
        "setupAudit": {"enum": ["complete", "pending"]},
        "setupMutations": {
          "type": "array", "items": {
            "type": "object", "additionalProperties": false,
            "required": ["phase", "target", "change"],
            "properties": {
              "phase": {"enum": ["before-observation", "during-observation"]},
              "target": {"enum": ["fixture", "profile", "position", "actors", "counters", "rng", "control-result", "observation"]},
              "change": {"type": "string", "minLength": 1}
            }
          }
        },
        "limits": {"type": "array", "minItems": 1, "uniqueItems": true, "items": {"type": "string", "minLength": 1}},
        "control": {
          "type": "object", "additionalProperties": false,
          "required": ["boundary", "fault", "expectedFailure"],
          "properties": {
            "boundary": {"enum": ["live-runtime", "recorded-evidence"]},
            "fault": {"type": "string", "minLength": 1},
            "expectedFailure": {"type": "string", "minLength": 1}
          }
        }
      },
      "if": {"properties": {"kind": {"const": "observer-control"}}},
      "then": {"required": ["control"]},
      "else": {"not": {"required": ["control"]}}
    },
    "runtimeProofClaims": {
      "type": "array",
      "minItems": 1,
      "uniqueItems": true,
      "items": {
        "enum": [
          "battle-capture-handoff", "controlled-action",
          "collision-decision", "control-release", "engine-boundary",
          "feedback-effect", "frame-pacing", "live-actor-identity",
          "host-cpu-pacing",
          "logical-commit", "natural-input", "population-bounds",
          "profile-resolution", "rendered-motion", "streaming-path",
          "terrain-selection", "world-transition"
        ]
      }
    },
    "visualArtifact": {
      "type": "object",
      "additionalProperties": false,
      "required": ["resultField", "path", "minimumBytes"],
      "properties": {
        "resultField": {"type": "string", "pattern": "^[A-Za-z][A-Za-z0-9_]*$"},
        "path": {"type": "string", "pattern": "^build/overworld-artifacts/[A-Za-z0-9._/-]+\\.png$"},
        "minimumBytes": {"type": "integer", "minimum": 1}
      }
    },
    "semanticEvent": {
      "enum": [
        "ACTOR_ATTACHED", "ACTOR_DETACHED", "CONTROL_REBOUND",
        "PROFILE_RESOLVED", "LANE_CHANGED", "INTENT_CREATED",
        "CANDIDATE_REJECTED", "PLAN_ACCEPTED", "MOTION_STARTED",
        "STREAM_WAITING", "STREAM_ADVANCED", "PATH_ADVANCED",
        "LOGICAL_COMMIT", "WORLD_EFFECT", "PRESENTATION_SYNCED",
        "MOTION_FINISHED", "MOTION_CANCELED", "CONTEXT_CHANGED",
        "ACTOR_REBOUND", "CONTROL_RETURNED",
        "MOUNT_PRESENTATION_POSITION", "MOUNT_PRESENTATION_STATE"
      ]
    },
    "semanticReason": {
      "enum": [
        "OK", "RETRY_WORLD_BUSY", "REJECTED_BLOCKED",
        "REJECTED_SIDE_TILE", "REJECTED_TERRAIN", "REJECTED_OCCUPIED",
        "REJECTED_RESERVED", "REJECTED_DIRECTION", "REJECTED_PROFILE",
        "UNSUPPORTED_LOCOMOTION", "MOTION_ALREADY_ACTIVE", "STALE_ACTOR",
        "STALE_FIELD", "PRESENTATION_MISSING", "DATA_UNAVAILABLE",
        "NO_MEMORY", "CONTEXT_LOST", "INVALID_ARGUMENT", "QUEUE_FULL",
        "UNSUPPORTED_COMMAND", "STALE_SEQUENCE"
      ]
    },
    "integerMatcher": {
      "type": "object",
      "additionalProperties": false,
      "minProperties": 1,
      "properties": {
        "equals": {"type": "integer", "minimum": 0, "maximum": 4294967295},
        "minimum": {"type": "integer", "minimum": 0, "maximum": 4294967295},
        "maximum": {"type": "integer", "minimum": 0, "maximum": 4294967295}
      }
    },
    "orderedEvent": {
      "type": "object",
      "additionalProperties": false,
      "required": ["id", "event"],
      "properties": {
        "id": {"type": "string", "pattern": "^[a-z0-9][a-z0-9._-]*$"},
        "event": {"$ref": "#/$defs/semanticEvent"},
        "reason": {"$ref": "#/$defs/semanticReason"},
        "valueA": {"$ref": "#/$defs/integerMatcher"},
        "valueB": {"$ref": "#/$defs/integerMatcher"}
      }
    },
    "eventCount": {
      "type": "object",
      "additionalProperties": false,
      "required": ["event", "minimum", "maximum"],
      "properties": {
        "event": {"$ref": "#/$defs/semanticEvent"},
        "reason": {"$ref": "#/$defs/semanticReason"},
        "valueA": {"$ref": "#/$defs/integerMatcher"},
        "valueB": {"$ref": "#/$defs/integerMatcher"},
        "minimum": {"type": "integer", "minimum": 0, "maximum": 2147483647},
        "maximum": {"type": "integer", "minimum": 0, "maximum": 2147483647}
      }
    },
    "frameTiming": {
      "type": "object",
      "additionalProperties": false,
      "required": ["from", "to", "minimum", "maximum"],
      "properties": {
        "from": {"type": "string", "pattern": "^[a-z0-9][a-z0-9._-]*$"},
        "to": {"type": "string", "pattern": "^[a-z0-9][a-z0-9._-]*$"},
        "minimum": {"type": "integer", "minimum": 0, "maximum": 2147483647},
        "maximum": {"type": "integer", "minimum": 0, "maximum": 2147483647}
      }
    }
  }
}
